id,category,title,author,facicle,year,start_page,end_page,pdf_link
ANU-M-1973-10000900020,Filosofía y Política,El determinismo,Juan Zaragüeta Bengoechea,1,1973,00009,00020,abrir_pdf.php?id=ANU-M-1973-10000900020
ANU-M-1973-10002100051,Filosofía y Política,Las nuevas ciudades: hacia nuevas formas de convivencia,Manuel Fraga Iribarne,1,1973,00021,00051,abrir_pdf.php?id=ANU-M-1973-10002100051
ANU-M-1973-10005300071,Filosofía y Política,"""Aggiornamento"" de la clasificación de las formas de gobierno: democracia, anarquía y cesarismo",Antonio Perpiñá Rodríguez,1,1973,00053,00071,abrir_pdf.php?id=ANU-M-1973-10005300071
ANU-M-1973-10007300108,Filosofía y Política,Las formulaciones constitucionales,José María Cordero Torres,1,1973,00073,00108,abrir_pdf.php?id=ANU-M-1973-10007300108
ANU-M-1973-10011100128,Sociología y Economía,Progreso y crisis en el cambio histórico,Carlos Ruiz del Castillo,1,1973,00111,00128,abrir_pdf.php?id=ANU-M-1973-10011100128
ANU-M-1973-10012900141,Sociología y Economía,Las inquietudes de fin de siglo,Valentín-Andrés Álvarez,1,1973,00129,00141,abrir_pdf.php?id=ANU-M-1973-10012900141
ANU-M-1973-10014300159,Sociología y Economía,Estructuras sociales y formas de saber,Luis Legaz Lacambra,1,1973,00143,00159,abrir_pdf.php?id=ANU-M-1973-10014300159
ANU-M-1973-10016100176,Sociología y Economía,Mutaciones fundamentales de la sociedad militar contemporánea,Manuel Díez Alegría,1,1973,00161,00176,abrir_pdf.php?id=ANU-M-1973-10016100176
ANU-M-1973-10017700214,Sociología y Economía,La inflación del Imperio Romano,Mariano Navarro Rubio,1,1973,00177,00214,abrir_pdf.php?id=ANU-M-1973-10017700214
ANU-M-1973-10021700230,Figuras Intelectuales,Semblanza de Luis Redonet,Francisco Moreno de Herrera,1,1973,00217,00230,abrir_pdf.php?id=ANU-M-1973-10021700230
ANU-M-1973-10023300291,Vida Académica,El pensamiento contemporáneo sobre la inmortalidad del alma,José Luis López Mosteiro,1,1973,00233,00291,abrir_pdf.php?id=ANU-M-1973-10023300291
ANU-M-1973-10029300302,Vida Académica,Crónica del curso 1970-1971,RACMYP,1,1973,00293,00302,abrir_pdf.php?id=ANU-M-1973-10029300302
ANU-M-1973-10030500305,Vida Académica,Últimas publicaciones de la Real Academia,RACMYP,1,1973,00305,00305,abrir_pdf.php?id=ANU-M-1973-10030500305
ANU-M-1974-10000900017,Filosofía y Política,Supuestos ideológicos de los sistemas económicos,Juan Zaragüeta Bengoechea,1,1974,00009,00017,abrir_pdf.php?id=ANU-M-1974-10000900017
ANU-M-1974-10001900052,Filosofía y Política,Cambio social y reforma política,Manuel Fraga Iribarne,1,1974,00019,00052,abrir_pdf.php?id=ANU-M-1974-10001900052
ANU-M-1974-10005500067,Filosofía y Política,La opinión pública,Francisco Moreno de Herrera,1,1974,00055,00067,abrir_pdf.php?id=ANU-M-1974-10005500067
ANU-M-1974-10006900097,Filosofía y Política,La Comunidad Económica Europea desde su ampliación,Antonio Truyol Serra,1,1974,00069,00097,abrir_pdf.php?id=ANU-M-1974-10006900097
ANU-M-1974-10010100131,Sociología y Economía,Diseño de una Sociología,Juan Zaragüeta Bengoechea,1,1974,00101,00131,abrir_pdf.php?id=ANU-M-1974-10010100131
ANU-M-1974-10013300150,Sociología y Economía,"Pasado, presente y futuro del desarrollo",Luis Olariaga,1,1974,00133,00150,abrir_pdf.php?id=ANU-M-1974-10013300150
ANU-M-1974-10015300171,Sociología y Economía,El centenario del marginalismo,José Castañeda Chornet,1,1974,00153,00171,abrir_pdf.php?id=ANU-M-1974-10015300171
ANU-M-1974-10017300214,Sociología y Economía,La evolución jurídico-social de la empresa,Alberto Martín Artajo,1,1974,00173,00214,abrir_pdf.php?id=ANU-M-1974-10017300214
ANU-M-1974-10021700235,Sociología y Economía,Varia económica,José María de Oriol y Urquijo,1,1974,00217,00235,abrir_pdf.php?id=ANU-M-1974-10021700235
ANU-M-1974-10023700266,Sociología y Economía,Geografía humanística del mundo en desarrollo,José María Cordero Torres,1,1974,00237,00266,abrir_pdf.php?id=ANU-M-1974-10023700266
ANU-M-1974-10027100283,Figuras Intelectuales,Tributo académico a la memoria de don Eloy Montero Gutiérrez,Carlos Ruiz del Castillo,1,1974,00271,00283,abrir_pdf.php?id=ANU-M-1974-10027100283
ANU-M-1974-10028500305,Figuras Intelectuales,Canalejas: evolución política de un hombre de Estado,Francisco Moreno de Herrera,1,1974,00285,00305,abrir_pdf.php?id=ANU-M-1974-10028500305
ANU-M-1974-10030900329,Vida Académica,Crónica del curso 1971-1972,RACMYP,1,1974,00309,00329,abrir_pdf.php?id=ANU-M-1974-10030900329
ANU-M-1974-10033100366,Vida Académica,Disertaciones académicas en los años 1940-1970,RACMYP,1,1974,00331,00366,abrir_pdf.php?id=ANU-M-1974-10033100366
ANU-M-1974-10036900369,Vida Académica,Últimas publicaciones de la Real Academia,RACMYP,1,1974,00369,00369,abrir_pdf.php?id=ANU-M-1974-10036900369
ANU-M-1974-20000700013,Necrológicas,En la muerte de nuestro Presidente,RACMYP,2,1974,00007,00013,abrir_pdf.php?id=ANU-M-1974-20000700013
ANU-M-1974-20001700080,Filosofía y Política,Esquema y teoría de la Historia,Juan Zaragüeta Bengoechea,2,1974,00017,00080,abrir_pdf.php?id=ANU-M-1974-20001700080
ANU-M-1974-20008100095,Filosofía y Política,Acoso y ocaso de las libertades humanas,José María Cordero Torres,2,1974,00081,00095,abrir_pdf.php?id=ANU-M-1974-20008100095
ANU-M-1974-20009700107,Filosofía y Política,Un vacío orgánico regional: el Mediterráneo,José María Cordero Torres,2,1974,00097,00107,abrir_pdf.php?id=ANU-M-1974-20009700107
ANU-M-1974-20010900127,Filosofía y Política,Filosofía y Sociología de la libertad,Luis Legaz Lacambra,2,1974,00109,00127,abrir_pdf.php?id=ANU-M-1974-20010900127
ANU-M-1974-20012900149,Filosofía y Política,"Sociedad, libertad, autoridad. Examen de un caso: los sucesos de mayo de 1968 en París",Antonio Perpiñá Rodríguez,2,1974,00129,00149,abrir_pdf.php?id=ANU-M-1974-20012900149
ANU-M-1974-20015300168,Sociología y Economía,La hacienda pública dentro de la economía nacional,José Castañeda Chornet,2,1974,00153,00168,abrir_pdf.php?id=ANU-M-1974-20015300168
ANU-M-1974-20016900200,Sociología y Economía,Alienación y convivencia en Sartre,Manuel Alonso Olea,2,1974,00169,00200,abrir_pdf.php?id=ANU-M-1974-20016900200
ANU-M-1974-20020100217,Sociología y Economía,Contrastes socio-políticos de dos países comunistas,Francisco Moreno de Herrera,2,1974,00201,00217,abrir_pdf.php?id=ANU-M-1974-20020100217
ANU-M-1974-20022100236,Figuras Intelectuales,In memoriam. Glosa de la obra del académico P. Venancio D. Carro,Carlos Ruiz del Castillo,2,1974,00221,00236,abrir_pdf.php?id=ANU-M-1974-20022100236
ANU-M-1974-20023700255,Figuras Intelectuales,«Memoria de José Larraz», José María de Areilza y Martínez Rodas,2,1974,00237,00255,abrir_pdf.php?id=ANU-M-1974-20023700255
ANU-M-1974-20025900270,Vida Académica,Crónica del curso 1972-1973,RACMYP,2,1974,00259,00270,abrir_pdf.php?id=ANU-M-1974-20025900270
ANU-M-1974-20027300273,Vida Académica,Últimas publicaciones,RACMYP,2,1974,00273,00273,abrir_pdf.php?id=ANU-M-1974-20027300273
ANU-M-1975-10000700010,Necrológicas,En la muerte del Secretario perpetuo don Juan Zaragüeta y Bengoechea,RACMYP,1,1975,00007,00010,abrir_pdf.php?id=ANU-M-1975-10000700010
ANU-M-1975-10001300037,Filosofía y Política,Vocabulario de sentido cognoscitivo de ser y estimativo de valores,Juan Zaragüeta Bengoechea,1,1975,00013,00037,abrir_pdf.php?id=ANU-M-1975-10001300037
ANU-M-1975-10003900059,Filosofía y Política,"Alteraciones trascendentales en las relaciones exteriores de España, por el advenimiento de una nueva era mundial, a consecuencia de cambio social",José María Cordero Torres,1,1975,00039,00059,abrir_pdf.php?id=ANU-M-1975-10003900059
ANU-M-1975-10006100097,Filosofía y Política,La inflación como problema político,Mariano Navarro Rubio,1,1975,00061,00097,abrir_pdf.php?id=ANU-M-1975-10006100097
ANU-M-1975-10009900121,Filosofía y Política,Cambio político e ideología,Gonzalo Fernández De La Mora,1,1975,00099,00121,abrir_pdf.php?id=ANU-M-1975-10009900121
ANU-M-1975-10012300149,Filosofía y Política,Los valores latentes de la constitución canovista,José María Cordero Torres,1,1975,00123,00149,abrir_pdf.php?id=ANU-M-1975-10012300149
ANU-M-1975-10015300197,Ciencias Jurídicas,La legislación delegada y su control en la Gran Bretaña,Manuel Fraga Iribarne,1,1975,00153,00197,abrir_pdf.php?id=ANU-M-1975-10015300197
ANU-M-1975-10020100219,Sociología y Economía,Algunos intelectuales del mundo actual,Francisco Moreno de Herrera,1,1975,00201,00219,abrir_pdf.php?id=ANU-M-1975-10020100219
ANU-M-1975-10022100253,Sociología y Economía,Cambio social: evolucionismo y funcionalismo,Manuel Alonso Olea,1,1975,00221,00253,abrir_pdf.php?id=ANU-M-1975-10022100253
ANU-M-1975-10025700275,Figuras Académicas,"Javier Conde: el hombre, el intelectual, el político",Luis Legaz Lacambra,1,1975,00257,00275,abrir_pdf.php?id=ANU-M-1975-10025700275
ANU-M-1975-10027700297,Figuras Académicas,José María de Yanguas Messía (1890-1974),Antonio Truyol Serra,1,1975,00277,00297,abrir_pdf.php?id=ANU-M-1975-10027700297
ANU-M-1975-10030100311,Vida Académica,El discurso para ingreso de D. Juan Zaragüeta,RACMYP,1,1975,00301,00311,abrir_pdf.php?id=ANU-M-1975-10030100311
ANU-M-1975-10031100388,Vida Académica,Crónica del curso 1973-1974,RACMYP,1,1975,00311,00388,abrir_pdf.php?id=ANU-M-1975-10031100388
ANU-M-1976-10000900011,Editorial,En el tránsito de 1975 a 1976. Muerte de Franco y proclamación de D. Juan Carlos I,RACMYP,1,1976,00009,00011,abrir_pdf.php?id=ANU-M-1976-10000900011
ANU-M-1976-10001500041,Filosofía,Consideraciones sobre la dignidad de la persona y de la vida humana,Luis Legaz Lacambra,1,1976,00015,00041,abrir_pdf.php?id=ANU-M-1976-10001500041
ANU-M-1976-10004300063,Filosofía,"El Movimiento de los ' Cristianos por el Socialismo""",Marcelo González Martín,1,1976,00043,00063,abrir_pdf.php?id=ANU-M-1976-10004300063
ANU-M-1976-10006500079,Filosofía,Socialismo y catolicismo,Francisco Moreno de Herrera,1,1976,00065,00079,abrir_pdf.php?id=ANU-M-1976-10006500079
ANU-M-1976-10008100111,Filosofía,Conocimiento virtual e interioridad en Suárez,José Ignacio Alcorta,1,1976,00081,00111,abrir_pdf.php?id=ANU-M-1976-10008100111
ANU-M-1976-10011500132,Política,El proceso de relativización de la democracia moderna,Carlos Ruiz del Castillo,1,1976,00115,00132,abrir_pdf.php?id=ANU-M-1976-10011500132
ANU-M-1976-10013300155,Política,"""Aggiornamento"" de la forma monárquica en España",Antonio Perpiñá Rodríguez,1,1976,00133,00155,abrir_pdf.php?id=ANU-M-1976-10013300155
ANU-M-1976-10015700168,Política,Las crisis españolas de fin de centuria: ante el bimilenario,José María Cordero Torres,1,1976,00157,00168,abrir_pdf.php?id=ANU-M-1976-10015700168
ANU-M-1976-10017100202,Sociología y Economía,La batalla de la estabilización,Mariano Navarro Rubio,1,1976,00171,00202,abrir_pdf.php?id=ANU-M-1976-10017100202
ANU-M-1976-10020300245,Sociología y Economía,La persona humana y la prestación de sus servicios (un apunte sobre historia de las ideas de Bodino a Hegel),Manuel Alonso Olea,1,1976,00203,00245,abrir_pdf.php?id=ANU-M-1976-10020300245
ANU-M-1976-10024700265,Sociología y Economía,"La economía del Estado en la ""Riqueza de las naciones” y en las naciones de nuestro tiempo",Enrique Fuentes Quintana,1,1976,00247,00265,abrir_pdf.php?id=ANU-M-1976-10024700265
ANU-M-1976-10026900297,Figuras Académicas,Juan Zaragüeta. Apuntes sobre su vida y su obra,Mariano Yela Granizo,1,1976,00269,00297,abrir_pdf.php?id=ANU-M-1976-10026900297
ANU-M-1976-10029900315,Figuras Académicas,Vida y obra de Fernando Castiella, José María de Areilza y Martínez Rodas,1,1976,00299,00315,abrir_pdf.php?id=ANU-M-1976-10029900315
ANU-M-1976-10031900335,Vida Académica,"De ""Re"" académica: los Secretarios de la Real Academia de Ciencias Morales y Políticas",José María Cordero Torres,1,1976,00319,00335,abrir_pdf.php?id=ANU-M-1976-10031900335
ANU-M-1976-10033700345,Vida Académica,Crónica del curso 1974-1975,RACMYP,1,1976,00337,00345,abrir_pdf.php?id=ANU-M-1976-10033700345
ANU-M-1976-10034700377,Vida Académica,Los concursos públicos convocados por la Real Academia,RACMYP,1,1976,00347,00377,abrir_pdf.php?id=ANU-M-1976-10034700377
ANU-M-1976-10037900418,Política,"La oligarquía, forma trascendental de gobierno",Gonzalo Fernández De La Mora,1,1976,00379,00418,abrir_pdf.php?id=ANU-M-1976-10037900418
ANU-M-1977-10000900021,Filosofía,Reflexiones sobre la sindéresis,Leopoldo-Eulogio Palacios,1,1977,00009,00021,abrir_pdf.php?id=ANU-M-1977-10000900021
ANU-M-1977-10002300039,Filosofía,El sentido comunitario del hombre,Angel González Álvarez,1,1977,00023,00039,abrir_pdf.php?id=ANU-M-1977-10002300039
ANU-M-1977-10004100060,Filosofía,"La falta de interioridad, drama de la cultura actual y de la Iglesia",Marcelo González Martín,1,1977,00041,00060,abrir_pdf.php?id=ANU-M-1977-10004100060
ANU-M-1977-10006300081,Política,Reflexiones sobre el proceso constitucional democrático actual en España,Carlos Ollero Gómez,1,1977,00063,00081,abrir_pdf.php?id=ANU-M-1977-10006300081
ANU-M-1977-10008300094,Política,La monarquía en el mundo actual,José María Cordero Torres,1,1977,00083,00094,abrir_pdf.php?id=ANU-M-1977-10008300094
ANU-M-1977-10009500109,Política,La monarquía actual de España,Francisco Moreno de Herrera,1,1977,00095,00109,abrir_pdf.php?id=ANU-M-1977-10009500109
ANU-M-1977-10011100150,Política,La Monarquía: España y Europa hoy,José Ignacio Alcorta,1,1977,00111,00150,abrir_pdf.php?id=ANU-M-1977-10011100150
ANU-M-1977-10015300170,Sociología y Economía,"Burocracia, tecnocracia, ideología",Luis Legaz Lacambra,1,1977,00153,00170,abrir_pdf.php?id=ANU-M-1977-10015300170
ANU-M-1977-10017100188,Sociología y Economía,El derecho humanista y los derechos humanos,Antonio Perpiñá Rodríguez,1,1977,00171,00188,abrir_pdf.php?id=ANU-M-1977-10017100188
ANU-M-1977-10018900219,Sociología y Economía,La batalla del desarrollo,Mariano Navarro Rubio,1,1977,00189,00219,abrir_pdf.php?id=ANU-M-1977-10018900219
ANU-M-1977-10022100255,Sociología y Economía,Consideraciones sobre la reforma del sindicalismo español,Manuel Alonso Olea,1,1977,00221,00255,abrir_pdf.php?id=ANU-M-1977-10022100255
ANU-M-1977-10025900276,Figuras Académicas,"Ser, vida y muerte del Excmo. Sr. don Alvaro López Núñez",Luis Jordana de Pozas,1,1977,00259,00276,abrir_pdf.php?id=ANU-M-1977-10025900276
ANU-M-1977-10027700288,Figuras Académicas,Don Luis Olariaga y Pujana. 1885-1976,José Castañeda Chornet,1,1977,00277,00288,abrir_pdf.php?id=ANU-M-1977-10027700288
ANU-M-1977-10029300337,Vida Académica,Premio de concurso: La inflación y la empresa,Francisco Úbeda Abad,1,1977,00293,00337,abrir_pdf.php?id=ANU-M-1977-10029300337
ANU-M-1977-10033900344,Vida Académica,Premio de concurso: La gastronomía y las ciencias morales y políticas, José María de Areilza y Martínez Rodas,1,1977,00339,00344,abrir_pdf.php?id=ANU-M-1977-10033900344
ANU-M-1977-10034700350,Vida Académica,Homenaje a la antigüedad académica,RACMYP,1,1977,00347,00350,abrir_pdf.php?id=ANU-M-1977-10034700350
ANU-M-1977-10035300356,Vida Académica,Crónica del curso 1975-1976,RACMYP,1,1977,00353,00356,abrir_pdf.php?id=ANU-M-1977-10035300356
ANU-M-1978-10000900024,Filosofía,Educación universitaria y «numerus clausus»,Angel González Álvarez,1,1978,00009,00024,abrir_pdf.php?id=ANU-M-1978-10000900024
ANU-M-1978-10002700046,Política,La actualización de los derechos humanos, José María de Areilza y Martínez Rodas,1,1978,00027,00046,abrir_pdf.php?id=ANU-M-1978-10002700046
ANU-M-1978-10004700067,Política,Las encrucijadas de los derechos humanos,Carlos Ruiz del Castillo,1,1978,00047,00067,abrir_pdf.php?id=ANU-M-1978-10004700067
ANU-M-1978-10006900102,Política,Los derechos humanos desde la persona,José Ignacio Alcorta,1,1978,00069,00102,abrir_pdf.php?id=ANU-M-1978-10006900102
ANU-M-1978-10010300113,Política,Un modelo presidencialista,Gonzalo Fernández De La Mora,1,1978,00103,00113,abrir_pdf.php?id=ANU-M-1978-10010300113
ANU-M-1978-10011500125,Política,"La Constitución de 1978, a vista de ponente",Manuel Fraga Iribarne,1,1978,00115,00125,abrir_pdf.php?id=ANU-M-1978-10011500125
ANU-M-1978-10012700160,Política,Perfil político de la Comunidad Europea,Luis Sánchez Agesta,1,1978,00127,00160,abrir_pdf.php?id=ANU-M-1978-10012700160
ANU-M-1978-10016300190,Sociología y Economía,La reforma de la empresa en la actualización de los derechos humanos,Alberto Martín Artajo,1,1978,00163,00190,abrir_pdf.php?id=ANU-M-1978-10016300190
ANU-M-1978-10019100215,Sociología y Economía,Las fuentes del derecho del trabajo en la Constitución,Manuel Alonso Olea,1,1978,00191,00215,abrir_pdf.php?id=ANU-M-1978-10019100215
ANU-M-1978-10021700234,Sociología y Economía,La neutralidad científica de la Sociología,Antonio Perpiñá Rodríguez,1,1978,00217,00234,abrir_pdf.php?id=ANU-M-1978-10021700234
ANU-M-1978-10023700284,Figuras Académicas,Para una semblanza del Conde de los Andes,Eugenio Vegas Latapie,1,1978,00237,00284,abrir_pdf.php?id=ANU-M-1978-10023700284
ANU-M-1978-10028700307,Vida Académica,a) Junta pública inaugural del curso 1976-77,Angel González Álvarez,1,1978,00287,00307,abrir_pdf.php?id=ANU-M-1978-10028700307
ANU-M-1978-10030900313,Vida Académica,b) Crónica del curso 1976-77,RACMYP,1,1978,00309,00313,abrir_pdf.php?id=ANU-M-1978-10030900313
ANU-M-1978-10031700323,Vida Académica,a) Junta pública inaugural del curso 1977-78,Mariano Navarro Rubio,1,1978,00317,00323,abrir_pdf.php?id=ANU-M-1978-10031700323
ANU-M-1978-10032500328,Vida Académica,b) Crónica del curso 1977-78,RACMYP,1,1978,00325,00328,abrir_pdf.php?id=ANU-M-1978-10032500328
ANU-M-1978-10033100333,Vida Académica,Homenaje a la antigüedad académica,RACMYP,1,1978,00331,00333,abrir_pdf.php?id=ANU-M-1978-10033100333
ANU-M-1979-10000900012,Necrológicas,Don Salvador de Madariaga,Alfonso García Valdecasas,1,1979,00009,00012,abrir_pdf.php?id=ANU-M-1979-10000900012
ANU-M-1979-10001300016,Necrológicas,Sesión necrológica por el fallecimiento del Excmo. Sr. D. José Gamón Aznar,Alfonso García Valdecasas,1,1979,00013,00016,abrir_pdf.php?id=ANU-M-1979-10001300016
ANU-M-1979-10001700019,Necrológicas,Sesión necrológica por el fallecimiento del Excmo. Sr. D. Alberto Martín Artajo,Alfonso García Valdecasas,1,1979,00017,00019,abrir_pdf.php?id=ANU-M-1979-10001700019
ANU-M-1979-10002300041,Filosofía,Noticia de los dos últimos cónclaves,Marcelo González Martín,1,1979,00023,00041,abrir_pdf.php?id=ANU-M-1979-10002300041
ANU-M-1979-10004300055,Filosofía,Nota crítica a la declaración conciliar sobre la libertad religiosa,Leopoldo-Eulogio Palacios,1,1979,00043,00055,abrir_pdf.php?id=ANU-M-1979-10004300055
ANU-M-1979-10005700117,Filosofía,In memoriam: el paulismo de Pablo VI,José Ignacio Alcorta,1,1979,00057,00117,abrir_pdf.php?id=ANU-M-1979-10005700117
ANU-M-1979-10012100136,Política,La función de gobierno en la Constitución de 1978,Luis Sánchez Agesta,1,1979,00121,00136,abrir_pdf.php?id=ANU-M-1979-10012100136
ANU-M-1979-10013700155,Política,La Constitución en el Senado (enmiendas sin consenso),Carlos Ollero Gómez,1,1979,00137,00155,abrir_pdf.php?id=ANU-M-1979-10013700155
ANU-M-1979-10015700182,Política,La defensa en el proceso constitucional,Manuel Díez Alegría,1,1979,00157,00182,abrir_pdf.php?id=ANU-M-1979-10015700182
ANU-M-1979-10018300202,Política,"La Constitución como norma, como decisión y como orden concreto",Antonio Perpiñá Rodríguez,1,1979,00183,00202,abrir_pdf.php?id=ANU-M-1979-10018300202
ANU-M-1979-10020300231,Política,El Consejo de Estado en la Constitución,Luis Jordana de Pozas,1,1979,00203,00231,abrir_pdf.php?id=ANU-M-1979-10020300231
ANU-M-1979-10023300246,Política,Las tres Europas, José María de Areilza y Martínez Rodas,1,1979,00233,00246,abrir_pdf.php?id=ANU-M-1979-10023300246
ANU-M-1979-10024700279,Política,La crisis del parlamentarismo,Gonzalo Fernández De La Mora,1,1979,00247,00279,abrir_pdf.php?id=ANU-M-1979-10024700279
ANU-M-1979-10028300304,Sociología y Economía,La Administración ante las transformaciones económicas y sociales contemporáneas,Laureano López Rodó,1,1979,00283,00304,abrir_pdf.php?id=ANU-M-1979-10028300304
ANU-M-1979-10030500319,Sociología y Economía,El centenario del Partido Socialista Obrero Español,Juan Velarde Fuertes,1,1979,00305,00319,abrir_pdf.php?id=ANU-M-1979-10030500319
ANU-M-1979-10032100325,Sociología y Economía,Economía y foralismo en la España del antiguo régimen,Carmelo Viñas y Mey,1,1979,00321,00325,abrir_pdf.php?id=ANU-M-1979-10032100325
ANU-M-1979-10032900339,Vida Académica,Crónica del curso 1978-1979,RACMYP,1,1979,00329,00339,abrir_pdf.php?id=ANU-M-1979-10032900339
ANU-M-1980-10000700008,Necrológicas,Fallecimiento del profesor Legaz,RACMYP,1,1980,00007,00008,abrir_pdf.php?id=ANU-M-1980-10000700008
ANU-M-1980-10001100029,Filosofía Social,Ideas sobre el progreso,Carlos Ruiz del Castillo,1,1980,00011,00029,abrir_pdf.php?id=ANU-M-1980-10001100029
ANU-M-1980-10003100055,Filosofía Social,Progreso progresivo y progreso regresivo,Antonio Perpiñá Rodríguez,1,1980,00031,00055,abrir_pdf.php?id=ANU-M-1980-10003100055
ANU-M-1980-10005900082,Política y Derecho,La crisis del Estado Constitucional,Manuel Fraga Iribarne,1,1980,00059,00082,abrir_pdf.php?id=ANU-M-1980-10005900082
ANU-M-1980-10008300100,Política y Derecho,El decoro político,Gonzalo Fernández De La Mora,1,1980,00083,00100,abrir_pdf.php?id=ANU-M-1980-10008300100
ANU-M-1980-10010100147,Política y Derecho,La regulación constitucional del proceso autonómico,Laureano López Rodó,1,1980,00101,00147,abrir_pdf.php?id=ANU-M-1980-10010100147
ANU-M-1980-10014900202,Política y Derecho,Requisitos de los actos administrativos,José Antonio García Trevijano,1,1980,00149,00202,abrir_pdf.php?id=ANU-M-1980-10014900202
ANU-M-1980-10020500236,Sociología y Economía,Progreso biológico y relaciones de trabajo,Manuel Alonso Olea,1,1980,00205,00236,abrir_pdf.php?id=ANU-M-1980-10020500236
ANU-M-1980-10023700260,Sociología y Economía,El tema del progreso material en Castilla,Juan Velarde Fuertes,1,1980,00237,00260,abrir_pdf.php?id=ANU-M-1980-10023700260
ANU-M-1980-10026100285,Sociología y Economía,La sociedad catalana en la España de los Austrias,Carmelo Viñas y Mey,1,1980,00261,00285,abrir_pdf.php?id=ANU-M-1980-10026100285
ANU-M-1980-10028900297,Vida Académica,Crónica del curso 1979-1980,RACMYP,1,1980,00289,00297,abrir_pdf.php?id=ANU-M-1980-10028900297
ANU-M-1981-10000700011,Necrológicas,«In memoriam» García-Trevijano,Luis Jordana de Pozas,1,1981,00007,00011,abrir_pdf.php?id=ANU-M-1981-10000700011
ANU-M-1981-10001300017,Necrológicas,«ln memoriam» Marcelo Caetano,Laureano López Rodó,1,1981,00013,00017,abrir_pdf.php?id=ANU-M-1981-10001300017
ANU-M-1981-10002100028,Teología y Filosofía,La Mística cristiana en sus caracteres generales,José Ignacio Alcorta,1,1981,00021,00028,abrir_pdf.php?id=ANU-M-1981-10002100028
ANU-M-1981-10002900060,Teología y Filosofía,El progreso de la inteligencia: evolución biológica y desarrollo cultural,Mariano Yela Granizo,1,1981,00029,00060,abrir_pdf.php?id=ANU-M-1981-10002900060
ANU-M-1981-10006300102,Política y Derecho,Política exterior y de defensa en la España de los años ochenta (1),Manuel Fraga Iribarne,1,1981,00063,00102,abrir_pdf.php?id=ANU-M-1981-10006300102
ANU-M-1981-10010300139,Política y Derecho,"Realidad de las regiones, de «las nacionalidades» y de los afanes autonómicos",Antonio Perpiñá Rodríguez,1,1981,00103,00139,abrir_pdf.php?id=ANU-M-1981-10010300139
ANU-M-1981-10014100156,Política y Derecho,Algunas reflexiones sobre el proceso autonómico,Laureano López Rodó,1,1981,00141,00156,abrir_pdf.php?id=ANU-M-1981-10014100156
ANU-M-1981-10015700179,Política y Derecho,Los principios materiales de la autonomía en la Constitución española de 1978,Luis Sánchez Agesta,1,1981,00157,00179,abrir_pdf.php?id=ANU-M-1981-10015700179
ANU-M-1981-10018100188,Política y Derecho,La emoción hispánica: Fr. Francisco de Vitoria,Augusto Barcia,1,1981,00181,00188,abrir_pdf.php?id=ANU-M-1981-10018100188
ANU-M-1981-10019100214,Sociología y Economía,La situación de la economía española en la hora de las autonomías,Enrique Fuentes Quintana,1,1981,00191,00214,abrir_pdf.php?id=ANU-M-1981-10019100214
ANU-M-1981-10021500237,Sociología y Economía,La Constitución de 1978 y la homogeneidad económica de España,Juan Velarde Fuertes,1,1981,00215,00237,abrir_pdf.php?id=ANU-M-1981-10021500237
ANU-M-1981-10023900266,Sociología y Economía,Bosquejo para una sociología egipcia,Manuel Díez Alegría,1,1981,00239,00266,abrir_pdf.php?id=ANU-M-1981-10023900266
ANU-M-1981-10026700287,Sociología y Economía,Perspectivas de la economía mexicana ante al auge del petróleo,Víctor L. Urquidi,1,1981,00267,00287,abrir_pdf.php?id=ANU-M-1981-10026700287
ANU-M-1981-10028900318,Sociología y Economía,Consideraciones que me sugieren las últimas sesiones de la Academia dedicadas al proceso económico,José María de Oriol y Urquijo,1,1981,00289,00318,abrir_pdf.php?id=ANU-M-1981-10028900318
ANU-M-1981-10031900339,Sociología y Economía,Algunos factores estructurales de la movilización regional en Europa,Salustiano del Campo Urbano,1,1981,00319,00339,abrir_pdf.php?id=ANU-M-1981-10031900339
ANU-M-1981-10034300349,Vida Académica,Informe de la Academia sobre el Proyecto de Ley de Autonomía Universitaria,RACMYP,1,1981,00343,00349,abrir_pdf.php?id=ANU-M-1981-10034300349
ANU-M-1981-10035100361,Vida Académica,Crónica del curso 1980-1981,RACMYP,1,1981,00351,00361,abrir_pdf.php?id=ANU-M-1981-10035100361
ANU-M-1982-10000700010,Necrológicas,«In memoriam» de Leopoldo Eulogio Palacios,RACMYP,1,1982,00007,00010,abrir_pdf.php?id=ANU-M-1982-10000700010
