id,category,title,author,facicle,year,start_page,end_page,pdf_link
ANU-M-1994-10035100362,Economía,Los agentes sociales: organizaciones patronales y sindicatos,Fabián Estapé Rodríguez,1,1994,00351,00362,abrir_pdf.php?id=ANU-M-1994-10035100362
ANU-M-1994-10036300378,Economía,Criterios para la revisión de algunos programas de protección social en España,Julio Segura Sánchez,1,1994,00363,00378,abrir_pdf.php?id=ANU-M-1994-10036300378
ANU-M-1994-10037900424,Economía,El sistema financiero en la recuperación de la economía española,Rafael Termes Carreró,1,1994,00379,00424,abrir_pdf.php?id=ANU-M-1994-10037900424
ANU-M-1994-10042500444,Economía,Estabilidad de precios: objetivo básico para la recuperacion económica. El papel de la política monetaria, José Ángel Sánchez Asiaín,1,1994,00425,00444,abrir_pdf.php?id=ANU-M-1994-10042500444
ANU-M-1994-10044500510,Economía,El mercosur: características y problemas,Enrique Jorge Roig,1,1994,00445,00510,abrir_pdf.php?id=ANU-M-1994-10044500510
ANU-M-1994-10051300520,Vida Académica. Negrología,"""In Memoriam"": Jesús Fueyo Álvarez",Manuel; Herrero y Rodríguez de Miñón Alonso Olea,1,1994,00513,00520,abrir_pdf.php?id=ANU-M-1994-10051300520
ANU-M-1994-10052100534,Vida Académica. Negrología,"""In Memoriam"": Ramón Salas Larrazábal",Rodrigo; González de Cardedal Fernández Carvajal,1,1994,00521,00534,abrir_pdf.php?id=ANU-M-1994-10052100534
ANU-M-1994-10053500538,Vida Académica. Negrología,"""In Memoriam"": Carlos Ollero Gómez",Manuel; Truyol Serra Fraga Iribarne,1,1994,00535,00538,abrir_pdf.php?id=ANU-M-1994-10053500538
ANU-M-1994-10053900542,Vida Académica. Disertaciones,Relación por orden cronológico,RACMYP,1,1994,00539,00542,abrir_pdf.php?id=ANU-M-1994-10053900542
ANU-M-1994-10054300546,Vida Académica. Disertaciones,"Extracto del Discurso de ingreso del Académico de Número, Excmo. Sr. D. Pablo Lucas Verdú",RACMYP,1,1994,00543,00546,abrir_pdf.php?id=ANU-M-1994-10054300546
ANU-M-1994-10054700551,Vida Académica. Disertaciones,"Extracto del Discurso de ingreso del Académico de Número, Excmo. Sr. D. Sabino Fernández Campo",RACMYP,1,1994,00547,00551,abrir_pdf.php?id=ANU-M-1994-10054700551
ANU-M-1994-10055300553,Vida Académica. Sesiones Públicas. Actos Académicos,"Homenaje a Román Perpiñá Grau,",Jordi; Velarde Fuertes Palafox,1,1994,00553,00553,abrir_pdf.php?id=ANU-M-1994-10055300553
ANU-M-1994-10055400575,Vida Académica. Sesiones Públicas. Actos Académicos,Discurso del académico de número Excmo Sr. Juan Velarde Fuertes,Juan Velarde Fuertes,1,1994,00554,00575,abrir_pdf.php?id=ANU-M-1994-10055400575
ANU-M-1994-10057700577,Vida Académica. Sesiones Públicas. Tribunas,Tribuna de las Autonomías,RACMYP,1,1994,00577,00577,abrir_pdf.php?id=ANU-M-1994-10057700577
ANU-M-1994-10057900579,Vida Académica,NOTICIARIO ACADÉMICO,RACMYP,1,1994,00579,00579,abrir_pdf.php?id=ANU-M-1994-10057900579
ANU-M-1995-10000900040,Política y Derecho,Administración pública y moral,Jesús González Pérez,1,1995,00009,00040,abrir_pdf.php?id=ANU-M-1995-10000900040
ANU-M-1995-10004100052,Política y Derecho,"Deconstrucción, comprensión y explicación. A propósito de la sociedad civil",Juan Vallet de Goytisolo,1,1995,00041,00052,abrir_pdf.php?id=ANU-M-1995-10004100052
ANU-M-1995-10005300080,Política y Derecho,La reforma del Senado: una propuesta.,Miguel Herrero y Rodríguez de Miñón,1,1995,00053,00080,abrir_pdf.php?id=ANU-M-1995-10005300080
ANU-M-1995-10008100112,Política y Derecho,Supuestos antropoteológicos de la teoría de la Constitución,Pablo Lucas Verdú,1,1995,00081,00112,abrir_pdf.php?id=ANU-M-1995-10008100112
ANU-M-1995-10011300134,Política y Derecho,La función real en España,Sabino Fernández Campo,1,1995,00113,00134,abrir_pdf.php?id=ANU-M-1995-10011300134
ANU-M-1995-10013500145,Política y Derecho,La nueva evangelización de Juan Pablo II: el mensaje de Asís,Adriano Alves Moreira,1,1995,00135,00145,abrir_pdf.php?id=ANU-M-1995-10013500145
ANU-M-1995-10014900164,Intervenciones Académicas. Ciencias Sociales,"Márquez, antítesis de Maquiavelo",Laureano López Rodó,1,1995,00149,00164,abrir_pdf.php?id=ANU-M-1995-10014900164
ANU-M-1995-10016500176,Intervenciones Académicas. Ciencias Sociales,El trabajo de la mujer en el derecho español,Manuel Alonso Olea,1,1995,00165,00176,abrir_pdf.php?id=ANU-M-1995-10016500176
ANU-M-1995-10017700192,Intervenciones Académicas. Ciencias Sociales,Exigencias para una auténtica recuperación,Juan Velarde Fuertes,1,1995,00177,00192,abrir_pdf.php?id=ANU-M-1995-10017700192
ANU-M-1995-10019300206,Intervenciones Académicas. Ciencias Sociales,Familia y población en Europa,Salustiano del Campo Urbano,1,1995,00193,00206,abrir_pdf.php?id=ANU-M-1995-10019300206
ANU-M-1995-10020700218,Intervenciones Académicas. Ciencias Sociales,La nueva descentralización administrativa,Fernando Garrido Falla,1,1995,00207,00218,abrir_pdf.php?id=ANU-M-1995-10020700218
ANU-M-1995-10021900226,Intervenciones Académicas. Ciencias Sociales,Las dos Españas,Antonio Garrigues y Díaz-Cañabate,1,1995,00219,00226,abrir_pdf.php?id=ANU-M-1995-10021900226
ANU-M-1995-10022700251,Intervenciones Académicas. Ciencias Sociales,Retablo de máscaras gitanescas (antropología de la diferencia),Carmelo Lisón Tolosana,1,1995,00227,00251,abrir_pdf.php?id=ANU-M-1995-10022700251
ANU-M-1995-10025500332,Economía,El modelo de economía abierta y el modelo castizo en el desarrollo económico de la España de los años 90,Enrique Fuentes Quintana,1,1995,00255,00332,abrir_pdf.php?id=ANU-M-1995-10025500332
ANU-M-1995-10033300342,Economía,Algunas reflexiones sobre la crisis mejicana,Luis Angel Rojo Duque,1,1995,00333,00342,abrir_pdf.php?id=ANU-M-1995-10033300342
ANU-M-1995-10034300390,Economía,El debate sobre la competitividad industrial en España, José Ángel Sánchez Asiaín,1,1995,00343,00390,abrir_pdf.php?id=ANU-M-1995-10034300390
ANU-M-1995-10039100402,Economía,Esquema biográfico de Ildefonso Cerdá Sunyer,Fabián Estapé Rodríguez,1,1995,00391,00402,abrir_pdf.php?id=ANU-M-1995-10039100402
ANU-M-1995-10040300418,Economía,El futuro del empleo en nuestras economías,Julio Segura Sánchez,1,1995,00403,00418,abrir_pdf.php?id=ANU-M-1995-10040300418
ANU-M-1995-10041900452,Economía,Los modelos socio-económicos y el desempleo,Rafael Termes Carreró,1,1995,00419,00452,abrir_pdf.php?id=ANU-M-1995-10041900452
ANU-M-1995-10045500472,Filosofía Social,La agricultura en el magisterio de la Iglesia,Marcelo González Martín,1,1995,00455,00472,abrir_pdf.php?id=ANU-M-1995-10045500472
ANU-M-1995-10047300492,Filosofía Social,Problemas de la universidad y responsabilidad de los universitarios,Víctor García Hoz,1,1995,00473,00492,abrir_pdf.php?id=ANU-M-1995-10047300492
ANU-M-1995-10049300508,Filosofía Social,La deconstrucción de la objetividad,José Luis Pinillos Díaz,1,1995,00493,00508,abrir_pdf.php?id=ANU-M-1995-10049300508
ANU-M-1995-10050900518,Filosofía Social,El estilo de pensar de Manuel García Morente,Alfonso López Quintás,1,1995,00509,00518,abrir_pdf.php?id=ANU-M-1995-10050900518
ANU-M-1995-10051900531,Filosofía Social,Sobre riqueza y pobreza en el comunitarismo clásico y su reflejo en el arte,Fernando Inciarte Armiñán,1,1995,00519,00531,abrir_pdf.php?id=ANU-M-1995-10051900531
ANU-M-1995-10053500547,Vida Académica. Negrología,"""In Memoriam"": Mariano Yela Granizo",Víctor; Garrigues y Díaz-Cañabate García Hoz,1,1995,00535,00547,abrir_pdf.php?id=ANU-M-1995-10053500547
ANU-M-1995-10054900552,Vida Académica. Disertaciones,Relación por orden cronológico,RACMYP,1,1995,00549,00552,abrir_pdf.php?id=ANU-M-1995-10054900552
ANU-M-1995-10055300562,Vida Académica. Disertaciones,"Extracto del Discurso de ingreso del Académico de Número, Excmo. Sr. D. Dalmacio Negro Pavón: La tradición liberal y el Estado",RACMYP,1,1995,00553,00562,abrir_pdf.php?id=ANU-M-1995-10055300562
ANU-M-1995-10056300563,Vida Académica,NOTICIARIO ACADÉMICO,RACMYP,1,1995,00563,00563,abrir_pdf.php?id=ANU-M-1995-10056300563
ANU-M-1996-10000900021,Vida Académica,Situación actual y papeles de las Reales Academias,Enrique Fuentes Quintana,1,1996,00009,00021,abrir_pdf.php?id=ANU-M-1996-10000900021
ANU-M-1996-10002500064,Ciclo sobre ética,Aportación de la Iglesia a una sociedad civil y de la teología a la ética pública en España,Olegario González de Cardedal,1,1996,00025,00064,abrir_pdf.php?id=ANU-M-1996-10002500064
ANU-M-1996-10006500080,Ciclo sobre ética,La ética del gobernante en nuestros autores del Siglo de Oro,Laureano López Rodó,1,1996,00065,00080,abrir_pdf.php?id=ANU-M-1996-10006500080
ANU-M-1996-10008100088,Ciclo sobre ética,Ética de la inteligencia,Gonzalo Fernández De La Mora,1,1996,00081,00088,abrir_pdf.php?id=ANU-M-1996-10008100088
ANU-M-1996-10008900102,Ciclo sobre ética,Ética y Sociedad Internacional,Antonio Truyol Serra,1,1996,00089,00102,abrir_pdf.php?id=ANU-M-1996-10008900102
ANU-M-1996-10010300116,Ciclo sobre ética,Ética del trabajo y del ocio,Manuel Alonso Olea,1,1996,00103,00116,abrir_pdf.php?id=ANU-M-1996-10010300116
ANU-M-1996-10011700158,Ciclo sobre ética,Ética en la Administración Pública,Jesús González Pérez,1,1996,00117,00158,abrir_pdf.php?id=ANU-M-1996-10011700158
ANU-M-1996-10015900174,Ciclo sobre ética,Ética y postmodernidad,José Luis Pinillos Díaz,1,1996,00159,00174,abrir_pdf.php?id=ANU-M-1996-10015900174
ANU-M-1996-10017500192,Ciclo sobre ética,Ética y razón de Estado: los documentos del CESID y el caso GAL,Fernando Garrido Falla,1,1996,00175,00192,abrir_pdf.php?id=ANU-M-1996-10017500192
ANU-M-1996-10019300208,Ciclo sobre ética,Concreción de los principios ético-naturales en principios generales de derecho y su reflejo en la interpretación jurídica,Juan Vallet de Goytisolo,1,1996,00193,00208,abrir_pdf.php?id=ANU-M-1996-10019300208
ANU-M-1996-10020900264,Ciclo sobre ética,Algunas reflexiones sobre la ética hechas desde el mundo financiero, José Ángel Sánchez Asiaín,1,1996,00209,00264,abrir_pdf.php?id=ANU-M-1996-10020900264
ANU-M-1996-10026500284,Ciclo sobre ética,Espacios éticos de la enfermedad,Carmelo Lisón Tolosana,1,1996,00265,00284,abrir_pdf.php?id=ANU-M-1996-10026500284
ANU-M-1996-10028500310,Ciclo sobre ética,Ética y mundo de los negocios,Rafael Termes Carreró,1,1996,00285,00310,abrir_pdf.php?id=ANU-M-1996-10028500310
ANU-M-1996-10031100340,Ciclo sobre ética,Perfiles morales y políticos del derecho a la intimidad,Antonio Enrique Pérez Luño,1,1996,00311,00340,abrir_pdf.php?id=ANU-M-1996-10031100340
ANU-M-1996-10034100357,Ciclo sobre ética,Conciencia y poder en la doctrina católica. Algunas reflexiones teológicas para la España de los 90,Monseñor Rouco Varela,1,1996,00341,00357,abrir_pdf.php?id=ANU-M-1996-10034100357
ANU-M-1996-10036100382,Intervenciones Académicas. Ciencias Sociales,El Tribunal de cuentas y el control del gasto,Juan Velarde Fuertes,1,1996,00361,00382,abrir_pdf.php?id=ANU-M-1996-10036100382
ANU-M-1996-10038300415,Intervenciones Académicas. Ciencias Sociales,La etnografía y la etnicidad en España y los Estados Unidos: un replanteamiento de la división del trabajo de las ciencias sociales,Davydd James Greenwood,1,1996,00383,00415,abrir_pdf.php?id=ANU-M-1996-10038300415
ANU-M-1996-10041900444,Economía,El déficit público como problema de nuestro tiempo,Enrique Fuentes Quintana,1,1996,00419,00444,abrir_pdf.php?id=ANU-M-1996-10041900444
ANU-M-1996-10044500458,Economía,Revaloración de la escolástica en la formación del pensamiento económico,Fabián Estapé Rodríguez,1,1996,00445,00458,abrir_pdf.php?id=ANU-M-1996-10044500458
ANU-M-1996-10045900473,Economía,Sobre la introducción y asimilación del análisis neoclásico marginalista en España,Julio Segura Sánchez,1,1996,00459,00473,abrir_pdf.php?id=ANU-M-1996-10045900473
ANU-M-1996-10047700486,Filosofía Social,El ateísmo en el mundo de hoy,Marcelo González Martín,1,1996,00477,00486,abrir_pdf.php?id=ANU-M-1996-10047700486
ANU-M-1996-10048700508,Filosofía Social,"Sobre los hábitos, último escalón de la formación cívio-social",Víctor García Hoz,1,1996,00487,00508,abrir_pdf.php?id=ANU-M-1996-10048700508
ANU-M-1996-10050900524,Filosofía Social,La tolerancia y la defensa entusiasta de la verdad,Alfonso López Quintas,1,1996,00509,00524,abrir_pdf.php?id=ANU-M-1996-10050900524
ANU-M-1996-10052500568,Filosofía Social,Modos del pensamiento político,Dalmacio Negro Pavón,1,1996,00525,00568,abrir_pdf.php?id=ANU-M-1996-10052500568
ANU-M-1996-10056900618,Filosofía Social,Juan Bautista Valenzuela y su interpretación de la sublevación de los Países Bajos,Jaime Brufau Prats,1,1996,00569,00618,abrir_pdf.php?id=ANU-M-1996-10056900618
ANU-M-1996-10062100632,Política y Derecho,La rutinización del carisma en los partidos políticos,Miguel Herrero y Rodríguez de Miñón,1,1996,00621,00632,abrir_pdf.php?id=ANU-M-1996-10062100632
ANU-M-1996-10063300650,Política y Derecho,Consideraciones jurídico-constitucionales sobre los acontecimientos del 23 de febrero de 1981,Sabino Fernández Campo,1,1996,00633,00650,abrir_pdf.php?id=ANU-M-1996-10063300650
ANU-M-1996-10065100658,Política y Derecho,"Hacia una nueva interpretación de la noción de ""Estados civilizados"" en derecho internacional contemporáneo",Juan Antonio Carrillo Salcedo,1,1996,00651,00658,abrir_pdf.php?id=ANU-M-1996-10065100658
ANU-M-1996-10066100675,Vida Académica. Negrología,"""In Memoriam"": Juan Sardá Dexeus",Manuel; Estapé Rodríguez Alonso Olea,1,1996,00661,00675,abrir_pdf.php?id=ANU-M-1996-10066100675
ANU-M-1996-10067700680,Vida Académica. Disertaciones,Relación por orden cronológico,RACMYP,1,1996,00677,00680,abrir_pdf.php?id=ANU-M-1996-10067700680
ANU-M-1996-10068100702,Vida Académica. Disertaciones,Extracto del discurso de ingreso del Académico de Número Excmo. Sr. D. Rodrigo Fernández-Carvajal González: Sabiduría y Ciencias del hombre,RACMYP,1,1996,00681,00702,abrir_pdf.php?id=ANU-M-1996-10068100702
ANU-M-1996-10070300712,Vida Académica,NOTICIARIO ACADÉMICO,RACMYP,1,1996,00703,00712,abrir_pdf.php?id=ANU-M-1996-10070300712
ANU-M-1996-10071300713,Vida Académica,TRIBUNAS,RACMYP,1,1996,00713,00713,abrir_pdf.php?id=ANU-M-1996-10071300713
ANU-M-1997-10000900036,Política y Derecho,Las partes en el proceso administrativo,Jesús González Pérez,1,1997,00009,00036,abrir_pdf.php?id=ANU-M-1997-10000900036
ANU-M-1997-10003700060,Política y Derecho,En torno a los modos de conocer y explicar lo conocido y su reflejo en el razonar (abstracción integrativa y abstracción sustractiva),Juan Vallet de Goytisolo,1,1997,00037,00060,abrir_pdf.php?id=ANU-M-1997-10003700060
ANU-M-1997-10006100084,Política y Derecho,Integración europea y democracia moderna,Miguel Herrero y Rodríguez de Miñón,1,1997,00061,00084,abrir_pdf.php?id=ANU-M-1997-10006100084
ANU-M-1997-10008500168,Política y Derecho,Dimensión axiológica de la Constitución,Pablo Lucas Verdú,1,1997,00085,00168,abrir_pdf.php?id=ANU-M-1997-10008500168
ANU-M-1997-10016900188,Política y Derecho,Las Reales Ordenanzas y la obediencia debida,Sabino Fernández Campo,1,1997,00169,00188,abrir_pdf.php?id=ANU-M-1997-10016900188
ANU-M-1997-10018900224,Política y Derecho,Los límites de la jurisdicción constitucional en relación con la jurisdicción contenciosa adminstrtiva en Costa Rica,Enrique Rojas Franco,1,1997,00189,00224,abrir_pdf.php?id=ANU-M-1997-10018900224
ANU-M-1997-10022500234,Política y Derecho,Regeneracionismo español y reformismo argentino: 1897-1930,Natalio Real de la Riva,1,1997,00225,00234,abrir_pdf.php?id=ANU-M-1997-10022500234
ANU-M-1997-10023700254,Intervenciones Académicas. Ciencias Sociales,El despido de un transexual,Manuel Alonso Olea,1,1997,00237,00254,abrir_pdf.php?id=ANU-M-1997-10023700254
ANU-M-1997-10025500278,Intervenciones Académicas. Ciencias Sociales,La economía en la Real Academia de Ciencias Morales y Políticas. Una primera aproximación,Juan Velarde Fuertes,1,1997,00255,00278,abrir_pdf.php?id=ANU-M-1997-10025500278
ANU-M-1997-10027900302,Intervenciones Académicas. Ciencias Sociales,Imagen de la empresa pública en España,Salustiano del Campo Urbano,1,1997,00279,00302,abrir_pdf.php?id=ANU-M-1997-10027900302
ANU-M-1997-10030300322,Intervenciones Académicas. Ciencias Sociales,La responsabilidad patrimonial del Estado: ¿hasta dónde debe indemnizar?,Fernando Garrido Falla,1,1997,00303,00322,abrir_pdf.php?id=ANU-M-1997-10030300322
ANU-M-1997-10032300336,Intervenciones Académicas. Ciencias Sociales,Los cambiantes gestos y flexibles discursos del honor,Carmelo Lisón Tolosana,1,1997,00323,00336,abrir_pdf.php?id=ANU-M-1997-10032300336
ANU-M-1997-10033700382,Intervenciones Académicas. Ciencias Sociales,Familiar y política social en España (1982-1996),Julio Iglesias de Ussel,1,1997,00337,00382,abrir_pdf.php?id=ANU-M-1997-10033700382
ANU-M-1997-10038500404,Economía,Estabilidad de precios. Inflación cero y crecimiento sostenible,Julio Segura Sánchez,1,1997,00385,00404,abrir_pdf.php?id=ANU-M-1997-10038500404
ANU-M-1997-10040500421,Economía,Las ideas económicas en Don Antonio Cánovas del Castillo,José María Serrano Sanz,1,1997,00405,00421,abrir_pdf.php?id=ANU-M-1997-10040500421
ANU-M-1997-10042500446,Filosofía Social,La corrupción administrativa,Gonzalo Fernández De La Mora,1,1997,00425,00446,abrir_pdf.php?id=ANU-M-1997-10042500446
ANU-M-1997-10044700454,Filosofía Social,La iglesia en la perspectiva del tercer milenio,Marcelo González Martín,1,1997,00447,00454,abrir_pdf.php?id=ANU-M-1997-10044700454
ANU-M-1997-10045500474,Filosofía Social,Una visión de lo invisible: el aprendizaje implícito,Víctor García Hoz,1,1997,00455,00474,abrir_pdf.php?id=ANU-M-1997-10045500474
ANU-M-1997-10047500492,Filosofía Social,El debate sobre la historia de los Estados Unidos,José Luis Pinillos Díaz,1,1997,00475,00492,abrir_pdf.php?id=ANU-M-1997-10047500492
ANU-M-1997-10049300508,Filosofía Social,Cómo lograr una formación integral. El modo óptimo de realizar la LOGSE,Alfonso López Quintás,1,1997,00493,00508,abrir_pdf.php?id=ANU-M-1997-10049300508
ANU-M-1997-10050900536,Filosofía Social,Navegar es necesario-vivir no es necesario,Olegario González de Cardedal,1,1997,00509,00536,abrir_pdf.php?id=ANU-M-1997-10050900536
ANU-M-1997-10053700552,Filosofía Social,De la función de los derechos fundamentales,Gregorio Peces-Barba Martínez,1,1997,00537,00552,abrir_pdf.php?id=ANU-M-1997-10053700552
ANU-M-1997-10055300574,Filosofía Social,Res pública amissa,Dalmacio Negro Pavón,1,1997,00553,00574,abrir_pdf.php?id=ANU-M-1997-10055300574
ANU-M-1997-10057900616,Vida Académica. Homenajes,Homenaje a D. Antonio Cánovas del Castillo,Salustiano del; Fernández De La Mora Campo Urbano,1,1997,00579,00616,abrir_pdf.php?id=ANU-M-1997-10057900616
ANU-M-1997-10061700618,Vida Académica. Negrología,"""In Memoriam"": Primitivo de la Quintana López",Antonio Garrigues y Díaz-Cañabate,1,1997,00617,00618,abrir_pdf.php?id=ANU-M-1997-10061700618
ANU-M-1997-10061900625,Vida Académica. Negrología,"""In Memoriam"": Luis Sánchez Agesta",Fernando; Lucas Verdú Garrido Falla,1,1997,00619,00625,abrir_pdf.php?id=ANU-M-1997-10061900625
ANU-M-1997-10062700630,Vida Académica. Disertaciones,Relación por orden cronológico,RACMYP,1,1997,00627,00630,abrir_pdf.php?id=ANU-M-1997-10062700630
ANU-M-1997-10063100645,Vida Académica. Disertaciones,Extracto del discurso de ingreso del Académico de Número Excmo. Sr. D. Jaime Terceiro Lomba,RACMYP,1,1997,00631,00645,abrir_pdf.php?id=ANU-M-1997-10063100645
ANU-M-1997-10064700649,Vida Académica. Tribunas,"Curso sobre ""La reforma de la jurisdicción contencioso-administrativa""",RACMYP,1,1997,00647,00649,abrir_pdf.php?id=ANU-M-1997-10064700649
ANU-M-1997-10065000651,Vida Académica. Tribunas,"Tribuna de lecturas: ""La política monetaria y la inflación en España""",RACMYP,1,1997,00650,00651,abrir_pdf.php?id=ANU-M-1997-10065000651
ANU-M-1997-10065200655,Vida Académica. Tribunas,"Tribuna joven: ""España, sociedad industrial avanzada, vista por los nuevos sociólogos""",RACMYP,1,1997,00652,00655,abrir_pdf.php?id=ANU-M-1997-10065200655
ANU-M-1997-10065700657,Vida Académica,NOTICIARIO ACADÉMICO,RACMYP,1,1997,00657,00657,abrir_pdf.php?id=ANU-M-1997-10065700657
ANU-M-1998-10000900036,Ciclos Monográficos. Europa,España ante el examen de convergencia de 1998,Enrique Fuentes Quintana,1,1998,00009,00036,abrir_pdf.php?id=ANU-M-1998-10000900036
ANU-M-1998-10003700052,Ciclos Monográficos. Europa,Los problemas de ajuste de la Unión Monetaria,Julio Segura Sánchez,1,1998,00037,00052,abrir_pdf.php?id=ANU-M-1998-10003700052
ANU-M-1998-10005300060,Ciclos Monográficos. Europa,El ajuste monetario,Luis Angel Rojo Duque,1,1998,00053,00060,abrir_pdf.php?id=ANU-M-1998-10005300060
ANU-M-1998-10006100082,Ciclos Monográficos. Europa,"Convergencias reales. Ciencia, tecnología y empresa", José Ángel Sánchez Asiaín,1,1998,00061,00082,abrir_pdf.php?id=ANU-M-1998-10006100082
ANU-M-1998-10008300102,Ciclos Monográficos. Europa,El proyecto europeo de España en el siglo XX,Salustiano del Campo Urbano,1,1998,00083,00102,abrir_pdf.php?id=ANU-M-1998-10008300102
ANU-M-1998-10010300130,Ciclos Monográficos. Europa,El mercado de trabajo en España y en la Unión Europea,Manuel Alonso Olea,1,1998,00103,00130,abrir_pdf.php?id=ANU-M-1998-10010300130
ANU-M-1998-10013100152,Ciclos Monográficos. Europa,Algunos aspectos institucionales del sistema financiero español en el marco de la Unión Europea,Jaime Tercero Lomba,1,1998,00131,00152,abrir_pdf.php?id=ANU-M-1998-10013100152
ANU-M-1998-10015300182,Ciclos Monográficos. Europa,Debate sobre la Unión Monetaria Europea,Rafael Termes Carreró,1,1998,00153,00182,abrir_pdf.php?id=ANU-M-1998-10015300182
ANU-M-1998-10018500202,Ciclos Monográficos. Constitución,"La Constitución Española, veinte años después",Manuel Fraga Iribarne,1,1998,00185,00202,abrir_pdf.php?id=ANU-M-1998-10018500202
ANU-M-1998-10020300220,Ciclos Monográficos. Constitución,"Génesis, desarrollo y perspectivas del estado de las autonomías",Miguel Herrero y Rodríguez de Miñón,1,1998,00203,00220,abrir_pdf.php?id=ANU-M-1998-10020300220
ANU-M-1998-10022100234,Ciclos Monográficos. Constitución,La Constitución Española ayer y hoy,Gregorio Peces-Barba Martínez,1,1998,00221,00234,abrir_pdf.php?id=ANU-M-1998-10022100234
ANU-M-1998-10023500248,Ciclos Monográficos. Constitución,La Corona y la Constitución de 1978,Sabino Fernández Campo,1,1998,00235,00248,abrir_pdf.php?id=ANU-M-1998-10023500248
ANU-M-1998-10024900264,Ciclos Monográficos. Constitución,Por qué voté negativamente la Constitución de 1978,Gonzalo Fernández De La Mora,1,1998,00249,00264,abrir_pdf.php?id=ANU-M-1998-10024900264
ANU-M-1998-10026500278,Ciclos Monográficos. Constitución,La elaboración de la Constitución Española: recuerdos personales,Fernando Garrido Falla,1,1998,00265,00278,abrir_pdf.php?id=ANU-M-1998-10026500278
ANU-M-1998-10027900308,Ciclos Monográficos. Constitución,Ambigüedades y silencios de la Constitución,Laureano López Rodó,1,1998,00279,00308,abrir_pdf.php?id=ANU-M-1998-10027900308
ANU-M-1998-10030900366,Ciclos Monográficos. Constitución,La Constitución y la reforma de la jurisdicción contencioso-administrativa,Jesús González Pérez,1,1998,00309,00366,abrir_pdf.php?id=ANU-M-1998-10030900366
ANU-M-1998-10036700392,Ciclos Monográficos. Constitución,¿Crisis del concepto de Constitución? La Constitución Española entre la norma y la realidad,Pablo Lucas Verdú,1,1998,00367,00392,abrir_pdf.php?id=ANU-M-1998-10036700392
ANU-M-1998-10039500410,Ciclos Monográficos. Generación del 98,Anatomía de una generación,Carmelo Lisón Tolosana,1,1998,00395,00410,abrir_pdf.php?id=ANU-M-1998-10039500410
ANU-M-1998-10041100436,Ciclos Monográficos. Generación del 98,"La doble crisis, ideológica e intelectual, del 98",Pedro Cerezo Galán,1,1998,00411,00436,abrir_pdf.php?id=ANU-M-1998-10041100436
ANU-M-1998-10043700486,Ciclos Monográficos. Generación del 98,Los economistas de la generación del 98,Juan Velarde Fuertes,1,1998,00437,00486,abrir_pdf.php?id=ANU-M-1998-10043700486
ANU-M-1998-10048700502,Ciclos Monográficos. Generación del 98,"El pensamiento del 98, cien años después",José Luis Pinillos Díaz,1,1998,00487,00502,abrir_pdf.php?id=ANU-M-1998-10048700502
ANU-M-1998-10050300514,Ciclos Monográficos. Generación del 98,Debate sobre la generación del 98,Dalmacio Negro Pavón,1,1998,00503,00514,abrir_pdf.php?id=ANU-M-1998-10050300514
ANU-M-1998-10051500523,Ciclos Monográficos. Generación del 98,Lo vivo y lo muerto del 98,Gonzalo Fernández De La Mora,1,1998,00515,00523,abrir_pdf.php?id=ANU-M-1998-10051500523
ANU-M-1998-10052700550,Ciclos Monográficos. La Iglesia en la España actual,Ubicación jurídico-social de la iglesia en la España de hoy,Antonio María Rouco Varela,1,1998,00527,00550,abrir_pdf.php?id=ANU-M-1998-10052700550
ANU-M-1998-10055100560,Ciclos Monográficos. La Iglesia en la España actual,El futuro inmediato del catolicismo en España,Marcelo González Martín,1,1998,00551,00560,abrir_pdf.php?id=ANU-M-1998-10055100560
ANU-M-1998-10056100622,Ciclos Monográficos. La Iglesia en la España actual,La iglesia en España: problemas de superficie y problemas de fondo,Olegario González de Cardedal,1,1998,00561,00622,abrir_pdf.php?id=ANU-M-1998-10056100622
ANU-M-1998-10062300634,Ciclos Monográficos. La Iglesia en la España actual,La situación de la iglesia en la España actual,Alfonso López Quintás,1,1998,00623,00634,abrir_pdf.php?id=ANU-M-1998-10062300634
ANU-M-1998-10063700660,Ciclos Monográficos. Sesiones ordinarias,Modos de captación de los valores -¿intuición eidética o abstracción por división o representación?- y su concreción,Juan Vallet de Goytisolo,1,1998,00637,00660,abrir_pdf.php?id=ANU-M-1998-10063700660
